{
  "schema_version": "0.2.0",
  "dataset_id": "context-producer-proof-v02",
  "capture_namespace": "v02-independent-producer",
  "harness": "codex",
  "import_options": {
    "version": "0.153.4",
    "work_item_id": "context-producer-proof",
    "agent_id": "independent-producer"
  },
  "cursor": {
    "sequence": "1",
    "prefix_bytes": "50629",
    "prefix_sha256": "8d63a66d95efd2b12904ecd387418d30e94b17ad9ca66a5c0d2606922788b97f",
    "record_count": "68"
  },
  "captures": [
    {
      "id": "capture:codex:4d9a2cb71e1875aabee650740576c2bf",
      "sequence": "0",
      "source_id": "codex:dc0cf6a542e5e8ae",
      "sha256": "dc0cf6a542e5e8ae00b0956e324e3ecfa696b683762b2d3215ac92dfeee2468b",
      "prefix_bytes": "24752",
      "prefix_sha256": "dc0cf6a542e5e8ae00b0956e324e3ecfa696b683762b2d3215ac92dfeee2468b",
      "record_count": "34",
      "observation_count": "48"
    },
    {
      "id": "capture:codex:53637854f94d91a2cb7fabaa965abc3c",
      "sequence": "1",
      "source_id": "codex:8d63a66d95efd2b1",
      "sha256": "8d63a66d95efd2b12904ecd387418d30e94b17ad9ca66a5c0d2606922788b97f",
      "prefix_bytes": "50629",
      "prefix_sha256": "8d63a66d95efd2b12904ecd387418d30e94b17ad9ca66a5c0d2606922788b97f",
      "record_count": "68",
      "observation_count": "99"
    }
  ],
  "evidence": {
    "schema_version": "0.1.0",
    "dataset_id": "context-producer-proof-v02",
    "sources": [
      {
        "id": "codex:8d63a66d95efd2b1",
        "harness": "codex",
        "format": "codex-rollout-jsonl",
        "version": "0.153.4",
        "sha256": "8d63a66d95efd2b12904ecd387418d30e94b17ad9ca66a5c0d2606922788b97f",
        "coverage": "partial",
        "description": "Codex rollout JSONL with additive response usage and legacy token snapshots."
      },
      {
        "id": "codex:dc0cf6a542e5e8ae",
        "harness": "codex",
        "format": "codex-rollout-jsonl",
        "version": "0.153.4",
        "sha256": "dc0cf6a542e5e8ae00b0956e324e3ecfa696b683762b2d3215ac92dfeee2468b",
        "coverage": "partial",
        "description": "Codex rollout JSONL with additive response usage and legacy token snapshots."
      }
    ],
    "observations": [
      {
        "id": "codex:capture:observation:02d1d15aaa8ad2a2e284d7251124f10f",
        "source_refs": [
          {
            "source_id": "codex:8d63a66d95efd2b1",
            "record": "snapshot:unknown:unknown:28:last:line:28"
          },
          {
            "source_id": "codex:dc0cf6a542e5e8ae",
            "record": "snapshot:unknown:unknown:28:last:line:28"
          }
        ],
        "kind": "model",
        "operation": "codex.token_count",
        "status": "ok",
        "accounting_scope": "snapshot",
        "usage": {
          "input_tokens": "110635",
          "output_tokens": "79",
          "cache_read_input_tokens": "101120",
          "cache_write_input_tokens": "0",
          "reasoning_output_tokens": "10"
        },
        "session_id": "sha256:ae867cf5813e89c706b258da90d6a0779cc2e7c8ea74d701c84dc249b74fd8bf",
        "model": "gpt-5.6-luna",
        "model_identity": "unknown",
        "subject_id": "snapshot:unknown:unknown:28:last",
        "grain": "event",
        "count_basis": "provider_native",
        "product": "codex",
        "attributes": {
          "source_record_type": "event_msg.token_count",
          "snapshot_kind": "last_token_usage",
          "native_id_hash": "1e74801c52ee8c92bde7d5d078e33438",
          "flAImegraph.lineage.native_id_hashes": "1e74801c52ee8c92bde7d5d078e33438",
          "flAImegraph.capture_namespace": "v02-independent-producer",
          "flAImegraph.capture_identity_basis": "native_or_verified_prefix_coordinate"
        },
        "agent_id": "independent-producer",
        "work_item_id": "context-producer-proof"
      },
      {
        "id": "codex:capture:observation:04e1d51f3c726e0c029e3e4d5585e191",
        "source_refs": [
          {
            "source_id": "codex:8d63a66d95efd2b1",
            "record": "snapshot:unknown:46:total:line:46"
          }
        ],
        "kind": "model",
        "operation": "codex.token_count.total",
        "status": "ok",
        "accounting_scope": "aggregate",
        "usage": {
          "input_tokens": "2176266",
          "output_tokens": "24589",
          "cache_read_input_tokens": "2063104",
          "cache_write_input_tokens": "0",
          "reasoning_output_tokens": "13275"
        },
        "session_id": "sha256:ae867cf5813e89c706b258da90d6a0779cc2e7c8ea74d701c84dc249b74fd8bf",
        "model": "gpt-5.6-luna",
        "model_identity": "unknown",
        "subject_id": "snapshot:unknown:46:total",
        "grain": "session",
        "count_basis": "provider_native",
        "product": "codex",
        "attributes": {
          "source_record_type": "event_msg.token_count",
          "snapshot_kind": "total_token_usage",
          "native_id_hash": "c16a743683da19902c20af1247d45375",
          "flAImegraph.lineage.native_id_hashes": "c16a743683da19902c20af1247d45375",
          "flAImegraph.capture_namespace": "v02-independent-producer",
          "flAImegraph.capture_identity_basis": "native_or_verified_prefix_coordinate"
        },
        "agent_id": "independent-producer",
        "work_item_id": "context-producer-proof"
      },
      {
        "id": "codex:capture:observation:0d06f93033d813239b59a237628df076",
        "source_refs": [
          {
            "source_id": "codex:8d63a66d95efd2b1",
            "record": "response:sha256:7e61dbeac3591cb910f221851dfeec9b487e014c3663715b2ddbf64af5083673:line:31"
          },
          {
            "source_id": "codex:dc0cf6a542e5e8ae",
            "record": "response:sha256:7e61dbeac3591cb910f221851dfeec9b487e014c3663715b2ddbf64af5083673:line:31"
          }
        ],
        "kind": "model",
        "operation": "codex.model",
        "status": "ok",
        "accounting_scope": "direct",
        "usage": {
          "input_tokens": "116894",
          "output_tokens": "79",
          "cache_read_input_tokens": "110336",
          "cache_write_input_tokens": "0",
          "reasoning_output_tokens": "10"
        },
        "session_id": "sha256:ae867cf5813e89c706b258da90d6a0779cc2e7c8ea74d701c84dc249b74fd8bf",
        "turn_id": "sha256:137ba044fa92c81657035734c8bc686163a17249cdeeac5b84ab0e83c16e36dd",
        "provider": "openai",
        "model": "gpt-5.6-luna",
        "model_identity": "setting",
        "subject_id": "sha256:7e61dbeac3591cb910f221851dfeec9b487e014c3663715b2ddbf64af5083673",
        "grain": "operation",
        "count_basis": "provider_native",
        "product": "codex",
        "work_item_id": "context-producer-proof",
        "attributes": {
          "source_record_type": "token_usage_record",
          "root_turn_id": "sha256:fabf5e57a199879a4b4282768b817a37dc55d0caf63c906f18e32d71a4b001f3",
          "native_total_tokens": "116973",
          "effort": "max",
          "parent_thread_id": "sha256:ae867cf5813e89c706b258da90d6a0779cc2e7c8ea74d701c84dc249b74fd8bf",
          "native_id_hash": "9d55ed39dcd52c755ed073c3906c714d",
          "flAImegraph.lineage.native_id_hashes": "9d55ed39dcd52c755ed073c3906c714d",
          "flAImegraph.capture_namespace": "v02-independent-producer",
          "flAImegraph.capture_identity_basis": "native_or_verified_prefix_coordinate"
        },
        "agent_id": "independent-producer"
      },
      {
        "id": "codex:capture:observation:0eea19f28665c6cbac11ea407da032f6",
        "source_refs": [
          {
            "source_id": "codex:8d63a66d95efd2b1",
            "record": "snapshot:unknown:unknown:68:last:line:68"
          }
        ],
        "kind": "model",
        "operation": "codex.token_count",
        "status": "ok",
        "accounting_scope": "snapshot",
        "usage": {
          "input_tokens": "138753",
          "output_tokens": "1060",
          "cache_read_input_tokens": "137984",
          "cache_write_input_tokens": "0",
          "reasoning_output_tokens": "838"
        },
        "session_id": "sha256:ae867cf5813e89c706b258da90d6a0779cc2e7c8ea74d701c84dc249b74fd8bf",
        "model": "gpt-5.6-luna",
        "model_identity": "unknown",
        "subject_id": "snapshot:unknown:unknown:68:last",
        "grain": "event",
        "count_basis": "provider_native",
        "product": "codex",
        "attributes": {
          "source_record_type": "event_msg.token_count",
          "snapshot_kind": "last_token_usage",
          "native_id_hash": "d8ec05b55d5eecc91c462cdcdcf3370f",
          "flAImegraph.lineage.native_id_hashes": "d8ec05b55d5eecc91c462cdcdcf3370f",
          "flAImegraph.capture_namespace": "v02-independent-producer",
          "flAImegraph.capture_identity_basis": "native_or_verified_prefix_coordinate"
        },
        "agent_id": "independent-producer",
        "work_item_id": "context-producer-proof"
      },
      {
        "id": "codex:capture:observation:0f3bfc8bb000d19041803e41dab53b26",
        "source_refs": [
          {
            "source_id": "codex:8d63a66d95efd2b1",
            "record": "response:sha256:d5987a103ed4975917d78996646277bf552be14dbe85e08a5339577f55256bea:line:57"
          }
        ],
        "kind": "model",
        "operation": "codex.model",
        "status": "ok",
        "accounting_scope": "direct",
        "usage": {
          "input_tokens": "136657",
          "output_tokens": "949",
          "cache_read_input_tokens": "135936",
          "cache_write_input_tokens": "0",
          "reasoning_output_tokens": "698"
        },
        "session_id": "sha256:ae867cf5813e89c706b258da90d6a0779cc2e7c8ea74d701c84dc249b74fd8bf",
        "turn_id": "sha256:137ba044fa92c81657035734c8bc686163a17249cdeeac5b84ab0e83c16e36dd",
        "provider": "openai",
        "model": "gpt-5.6-luna",
        "model_identity": "setting",
        "subject_id": "sha256:d5987a103ed4975917d78996646277bf552be14dbe85e08a5339577f55256bea",